Title,About,Usuability,Link
futureidea-ai-tools-dataset,ðŸ’¥ðŸ’¥This dataset encompasses diverse AI applications ranging from machine learning algorithms and natural language processing tools to computer vision frameworks and predictive analytics models. **It serves as a valuable resource for researchers developers and entrepreneurs seeking cutting-edge AI technologies to shape the future. With its extensive scope and meticulously selected tools this dataset offers a comprehensive exploration of the AI landscape inspiring creative solutions and paving the way for transformative advancements across various industries.The Futureidea_3K+_AI_Tools_Dataset boasts a multitude of features providing users with a comprehensive and dynamic resource for their AI endeavors. Some key features of this dataset include:Extensive Tool Collection: The dataset comprises over 3000 meticulously curated AI tools covering a wide range of domains such as machine learning natural language processing computer vision and predictive analytics.**Diversity of Applications: **The tools in the dataset cater to diverse applications enabling users to explore AI solutions for various industries and problem domains including healthcare finance e-commerce transportation and more.Tool Descriptions and Documentation: Each tool comes with detailed descriptions and documentation offering valuable insights into its functionality usage and implementation. This information assists users in understanding and effectively utilizing the tools in their projects.Integration and Compatibility: The dataset includes information about the compatibility and integration capabilities of each tool allowing users to assess their suitability for different software platforms programming languages and frameworks.Performance Metrics and Benchmarks: Users can access performance metrics and benchmarks associated with the AI tools providing valuable insights into their effectiveness and helping users make informed decisions when selecting tools for their projects.**Versioning and Updates: **The dataset tracks tool versions and provides information about updates ensuring users have access to the latest advancements and improvements in AI technologies.Community Ratings and Reviews: The dataset incorporates community-driven ratings and reviews allowing users to benefit from the experiences and recommendations of other developers researchers and practitioners in the AI community.Licensing and Usage Terms: Information regarding licensing and usage terms of the AI tools is included helping users understand the legal aspects and any restrictions associated with their implementation.Search and Filtering Capabilities: The dataset offers robust search and filtering capabilities enabling users to find specific tools based on their requirements such as functionalities programming language compatibility and more.Open and Accessible Format: The dataset is provided in an open and accessible format allowing users to easily retrieve analyze and integrate the AI tools into their projects.Overall the Futureidea_3K+_AI_Tools_Dataset provides a comprehensive and feature-rich resource for exploring evaluating and leveraging a diverse range of AI tools empowering users to drive innovation and shape the future with cutting-edge AI technologies.,9.41,https://www.kaggle.com/datasets/shahriarrahman009/futureidea-ai-tools-dataset
flipkart-fasion-products-dataset,Clean and Ready to use raw datasets for research and analysis.5.7 million + records Flipkart datasetFlipkart is the largest E-commerce website based in India. The pre-crawled dataset has more than 5.7 million records.Where to use the datasetTrain machine learning algorithmsCheck discounts of various category's fieldsFind out which brand and categories have the best discount,9.41,https://www.kaggle.com/datasets/aaditshukla/flipkart-fasion-products-dataset
cardiovascular-diseases-risk-prediction-dataset,The Behavioral Risk Factor Surveillance System (BRFSS) is the nationâ€™s premier system of health-related telephone surveys that collect state data about U.S. residents regarding their health-related risk behaviors chronic health conditions and use of preventive services. I preprocessed and cleaned the BRFSS Dataset. From 304 unique variables I hand-picked 19 variables that relates to lifestyle factors of a person that can be contributed to being at risk with any form of Cardiovascular Diseases.You can also read the research article that was published that made use of this dataset.Read Here!,10.00,https://www.kaggle.com/datasets/alphiree/cardiovascular-diseases-risk-prediction-dataset
uk-retail-sales-pounds-data-1986-2023,This dataset contains all the data tables related to the total sales and average weekly spending estimates for each retail sector in Great Britain in thousands of pounds published in March 2023 by the Office for National Statistics (ONS) from Q1 1971 - Q1 2023.,8.24,https://www.kaggle.com/datasets/matarrgaye/uk-retail-sales-pounds-data-1986-2023
largest-malls,This is a partial list of the world's largest shopping malls based on gross leasable area (GLA) with a GLA of at least 250000 m2 (2700000 sq ft).,10.00,https://www.kaggle.com/datasets/drahulsingh/largest-malls
poland-used-cars-offers,Dataset scraped from largest Polish used and new cars offers website otomoto.pl. By analyzing this dataset researchers can explore various aspects of the Polish used car market such as price distribution by brand and model the relationship between mileage and price popular fuel types and their availability in different regions and the impact of car age on pricing. Additionally this dataset can facilitate the development of predictive models for estimating the value of used cars based on their specifications and historical market trends.,9.41,https://www.kaggle.com/datasets/wspirat/poland-used-cars-offers
70-football-leagues-data-2019-2023,Title: 70 Football Leagues Data (2019-2023)Dataset Description:This dataset provides comprehensive data on 70 football leagues from various countries around the world. The dataset covers the period from 2019 to 2023 offering a rich collection of football-related information for data analysis research and visualization purposes.Content:The dataset contains a wealth of football-related data including match statistics team information player details and league standings. The dataset covers a diverse range of leagues encompassing top-tier competitions as well as lower divisions allowing users to explore football data at various levels.Key Features:Match ResultsHome GoalsAway GoalsHome Goals in First HalfAway Goals in First HalfMatch Odds for 1X2 and O/U 2.5 GoalsTotal Goals in the MatchPotential Use Cases:Data Source:The data for this dataset is collected from reliable sources including official football websites sports news portals and reputable football data providers. The dataset is carefully curated and quality-checked to ensure accuracy and reliability.Updates and Maintenance:The dataset will be periodically updated to include new seasons leagues and any necessary data corrections. User feedback and contributions are welcome to improve the dataset and keep it up-to-date.Disclaimer:While utmost care has been taken to ensure the accuracy and reliability of the data errors or inconsistencies may still exist. Users are encouraged to verify the data with official sources before making any critical decisions based on the dataset.Acknowledgments:We would like to acknowledge the contributions of the data providers football organizations and sports enthusiasts whose efforts have made this dataset possible. Their dedication to collecting and sharing football data is greatly appreciated.Note:Please be respectful of the data usage policy and terms of service of the dataset. Use the data responsibly and ensure compliance with any applicable legal requirements.,7.06,https://www.kaggle.com/datasets/takidaki/70-football-leagues-data-2019-2023
olid-i,Artificial intelligence (AI) has taken the globe by storm since its inception and the enormous agriculture sector is no exception. The progress of any AI-assisted mechanism is heavily reliant on massive training data. Although the application of AI in plant leaf management has garnered prominence in recent years there is still a dearth of data especially in the case of tropical and subtropical crops. In light of this we present a public dataset containing 4749 leaf images which include healthy nutritionally deficient and pest-infested leaves of tomato (Solanum lycopersicum) eggplant (Solanum melongena) cucumber (Cucumis sativus) bitter gourd (Momordica charantia) snake gourd (Trichosanthes cucumerina) ridge gourd (Luffa acutangula) ash gourd (Benincasa hispida) and bottle gourd (Lagenaria siceraria). The dataset comprises 57 unique classes with high-resolution photos (3024 x 3024). The images have been captured at three different sites in Bangladesh in natural field settings and arduously labeled by an expert panel. This collection features the highest number of plant stress classes and the first multi-label classification problem in the agro-domain. The effective utilization of our dataset will result in an abundance of leaf disease diagnosis algorithms pest identification and classification tools and nutritional deficiency estimation strategies to highlight a few.Note: The excel file comprises a detailed class distribution.,8.75,https://www.kaggle.com/datasets/raiaone/olid-i
world-happiness-2015,The World Happiness Report is a publication by the United Nations Sustainable Development Solutions Network which ranks countries based on their levels of happiness and well-being. However my knowledge cutoff is in September 2021 and I don't have access to real-time data. Therefore I don't have the specific rankings for the World Happiness Report for the year 2015. However I can provide you with the top-ranking countries based on the 2021 World Happiness Report if that would be of interest to you.,7.06,https://www.kaggle.com/datasets/sanjanchaudhari/world-happiness-2015
2023-bike-model-dataset-all-data-you-need,This dataset can be used to analyze the performance features and pricing of different motorcycles. It can also be used to identify trends in the motorcycle industry.Here are some of the ways that this dataset can be used:,9.41,https://www.kaggle.com/datasets/peshimaammuzammil/2023-bike-model-dataset-all-data-you-need
sentiment-and-emotions-of-tweets,"The csv dataset contains all the Twitter mentions of Dell during first three quarters of 2022 (Jan 01 - Sept 30) along with the sentiment and emotions of each tweet. It has about 25k tweets along with date timestamp username and tweet Id sentiment sentiment_score emotion and emotion_score.The sentiments and emotions has been classified using ðŸ¤— transformers check out this notebook to learn more.Sentiments:  positive negative and neutralEmotions:  joy love optimism pessimism trust surprise anticipation sadness anger disgust and fear.The tweets have been scraped using ""snscrape"" library which does not require Twitter's API access. You can follow this notebook to learn more about scrapping tweets using ""snscrape"".",10.00,https://www.kaggle.com/datasets/ankitkumar2635/sentiment-and-emotions-of-tweets
roblox-stock-pricing-2021-2023,"The ""Roblox Stock Price Dataset (2021-2023)"" curated by Arslan provides comprehensive daily trading data for Roblox Corporation's stock from its initial public offering (IPO) date on March 10 2021 until June 19 2023. The dataset was extracted from Yahoo Finance a reputable financial platform.Roblox Corporation founded by David Baszucki and Erik Cassel originated from their previous venture Knowledge Revolution an educational software company. They established Roblox Corporation in 2004 starting with the development of the game DynaBlocks later renamed Roblox and officially released on September 1 2006. Since then Roblox has grown to become a prominent player in the gaming industry.The dataset contains key stock market indicators such as the opening price closing price highest price lowest price and trading volume for each trading day. The data is organized chronologically enabling users to analyze the stock's performance track trends and gain insights into Roblox Corporation's market value over the specified period.Please note that the dataset includes data until June 19 2023. Researchers investors and analysts can utilize this dataset to perform various quantitative analyses evaluate investment strategies and explore the historical performance of Roblox stock.By leveraging this comprehensive dataset stakeholders can uncover valuable patterns trends and correlations to make informed decisions within the context of the dynamic and evolving Roblox Corporation and the stock market at large.",10.00,https://www.kaggle.com/datasets/arslanr369/roblox-stock-pricing-2021-2023
farfetch-us-full-product-with-prices-and-discounts,Full product list page web data collection from farfetch.com USA.This is a full feature dataset for anyone to use and build with no restrictions.Data Structure Full documentationThis data is also available refreshed daily at databoutique.com,9.38,https://www.kaggle.com/datasets/databoutique/farfetch-us-full-product-with-prices-and-discounts
ipl-match-result-2008-2022,This dataset contains information about cricket matches including city date season match number participating teams venue toss details match outcome winning team margin method player of the match and umpire details.Column Name and Description:ID: The unique identifier for each match.City: The city where the match took place.Date: The date of the match.Season: The season in which the match was played.MatchNumber: The number of the match in the season.Team1: The name of the first team.Team2: The name of the second team.Venue: The venue where the match was held.TossWinner: The team that won the toss.TossDecision: The decision made by the team that won the toss (batting or bowling).SuperOver: Indicates whether a super over was played (1 for yes 0 for no).WinningTeam: The team that won the match.WonBy: The outcome of the match (e.g. runs wickets).Margin: The margin by which the winning team won the match.Method: The method used to determine the winner (e.g. Duckworth-Lewis Bowl Out).Player_of_Match: The player who was awarded the Man of the Match title.Team1Players: A list of players from Team1.Team2Players: A list of players from Team2.Umpire1: The name of the first umpire.Umpire2: The name of the second umpire.,6.47,https://www.kaggle.com/datasets/yatharththakare/ipl-match-result-2008-2022
top-charts-artists-country,"I made this dataset for a data vizualisation project about Spotify top artists countries and top rank songs world repartition. This is a list of 966 couples of Artists / Countries.The artist list has been taken of the ""Best Songs on Spotify for every year (2000-2023)"" database from Conor Van Eden. I've extracted the countries with Python using the Musicbrainz API and doing hand web scraping for the few ones that were not returned by the API.The countries have been cleaned up. Every country exists with a unique label. There is no intersection between countries (i.e: United Kingdom / England)",10.00,https://www.kaggle.com/datasets/hedizekri/top-charts-artists-country
imagesoasis,The dataset used is the OASIS MRI dataset which consists of 80000 brain MRI images. The images have been divided into four classes based on Alzheimer's progression. The dataset aims to provide a valuable resource for analyzing and detecting early signs of Alzheimer's disease.To make the dataset accessible the original .img and .hdr files were converted into Nifti format (.nii) using FSL (FMRIB Software Library). The converted MRI images of 461 patients have been uploaded to a GitHub repository which can be accessed in multiple parts.For the neural network training 2D images were used as input. The brain images were sliced along the z-axis into 256 pieces and slices ranging from 100 to 160 were selected from each patient. This approach resulted in a comprehensive dataset for analysis.Patient classification was performed based on the provided metadata and Clinical Dementia Rating (CDR) values resulting in four classes: demented very mild demented mild demented and non-demented. These classes enable the detection and study of different stages of Alzheimer's disease progression.During the dataset preparation the .nii MRI scans were converted to .jpg files. Although this conversion presented some challenges the files were successfully processed using appropriate tools. The resulting dataset size is 1.3 GB.With this comprehensive dataset the project aims to explore various neural network models and achieve optimal results in Alzheimer's disease detection and analysis.,8.75,https://www.kaggle.com/datasets/ninadaithal/imagesoasis
housing-sql-project,This dataset contains information about housing sales in Nashville TN such as property owner sales and tax information. The SQL queries I created for Data Cleaning can be found here.,8.82,https://www.kaggle.com/datasets/bvanntruong/housing-sql-project
largest-art-museums,The following is a list of art museums ranked by gallery space as published by credible sources. Only structures with exhibition spaces larger than 8000 square metres (86000 square feet) are included.,9.41,https://www.kaggle.com/datasets/drahulsingh/largest-art-museums
tesla-inc-last-5-years-stock-historical-data,Explore the fascinating journey of Tesla's stock performance over the past 5 years and gain valuable insights into its growth trends and market behavior. Tesla the renowned electric vehicle manufacturer has captured the world's attention with its groundbreaking innovations and exponential growth. In this blog post we will dive into Tesla's stock performance over the past five years unraveling key trends and providing valuable insights for investors and enthusiasts alike.The Dataset holds Tesla Stock Prices from last 5 years. Date:  First Column represents the data.Open: Tesla Stock Opening Price for the given date. High: Tesla Stock price highest price point hit. Low: Tesla Stock price lowest price for the given date Tesla Stock price lowest price for the given date.adj Close: Adjusted stock closing price of Tesla after taking dividends stock splits and new stock offerings into account. Volume: Amount of an Tesla Stock that changed hands over the course of the trading dSource: https://finance.yahoo.com,10.00,https://www.kaggle.com/datasets/jimschacko/tesla-inc-last-5-years-stock-historical-data
bitcoin-usd-daily-price-with-volume-2015-2023,The Bitcoin Historical Price dataset offers a comprehensive and detailed record of the price dynamics of Bitcoin (BTC) against the US Dollar (USD) over an extended period. Spanning from 2015 to 2023 this dataset provides a wealth of valuable information for researchers analysts and cryptocurrency enthusiasts.This dataset captures the daily price movements of Bitcoin allowing users to analyze the market trends price volatility and overall performance of the leading cryptocurrency. Each data point includes the closing price of Bitcoin in USD for a particular day as well as the corresponding trading volume indicating the level of market activity during that period.By examining this dataset researchers can gain insights into the historical price fluctuations of Bitcoin identifying significant market events such as bull and bear runs price corrections and periods of stability. It enables the analysis of long-term trends and the identification of patterns that may assist in predicting future price movements.Moreover the inclusion of trading volume data provides additional context to the price movements. Volume can offer insights into the market liquidity investor sentiment and the overall demand for Bitcoin during specific timeframes. By correlating price and volume data analysts can gain a deeper understanding of market dynamics and the forces driving Bitcoin's price action.The Bitcoin Historical Price dataset is an invaluable resource for data-driven research quantitative analysis backtesting trading strategies and building predictive models. It serves as a foundation for studying Bitcoin's historical performance understanding the cryptocurrency market and making informed decisions in the ever-evolving world of cryptocurrencies.,9.41,https://www.kaggle.com/datasets/prkhrawsthi/bitcoin-usd-daily-price-with-volume-2015-2023
covid-impact,This dataset contains information about COVID deaths and vaccinations illustrating the total impact of the pandemic on mortality globally. The complete Our World in Data COVID-19 dataset is open-source updated daily and can be found here.The SQL queries I created for Data Exploration can be found on this GitHub Repository.The COVID Dashboard I created in summary of this data exploration can be found on this Tableau Public page.For this dataset's Data Exploration we will be utilizing SQL queries to examine the likelihood of death if someone contracts COVID in the United States. This query was created in curiosity of the conditions in my country the US but can be modified by location. We also explore the infection rate compared to the total population of each country globally. ,8.82,https://www.kaggle.com/datasets/bvanntruong/covid-impact
fbref-data,Name and Links to FBref profiles of all Top 5 league footballers.Football Player Data Scraped from Fbref and Segregated by Position.Use Cases: Validating Eye Test Finding Similar Players Finding complementing Players.This is for easier usage of the FBRef Data available online.Check out discussion for giving feedback and sharing any ideas and improvements required.,10.00,https://www.kaggle.com/datasets/soulcelestia/fbref-data
millennium-development-goals-mdgs-1990-2014,The Millennium Development Goals (MDGs) dataset is a collection of indicators drawn from the World Development Indicators reorganized according to the goals and targets of the Millennium Development Goals. The dataset covers the period from 1990 to 2014 and provides insights into various aspects of global development.The Millennium Development Goals (MDGs) dataset includes six CSV files that provide valuable information related to global development. The files cover the period from 1990 to 2014 and contain data indicators and details about countries series and footnotes. By analyzing this dataset researchers and data analysts can gain insights into various aspects of development progress worldwide.Acknowledgement: I would like to thank the World Bank for providing the Millennium Development Goals (MDGs) dataset through their World Development Indicators. I acknowledge the World Bank's efforts in collecting organizing and making this valuable dataset publicly available for research analysis and informed decision-making. https://data.world/worldbank/,10.00,https://www.kaggle.com/datasets/aryansingh0909/millennium-development-goals-mdgs-1990-2014
