Title,About,Usuability,Link
cellular-network-analysis-dataset,This dataset provides realistic signal metrics for 3G 4G 5G and LTE network analysis using DragonOS Spike and SDR devices. The dataset aims to provide a representative sample of signal measurements for various network types and locations in Bihar India. The dataset also replicates the hardware setup involving the Spike software DragonOS running on the Valve Steam Deck gaming system BB60C spectrum analyzer powered by an external USB3 hub connected to the Steam Deck's USB C port srsRan running on a separate laptop for creating the base station using the bladeRFxA9 device.Features:The dataset includes the following features:Timestamp: The timestamps represent the time at which the signal metrics were recorded with a 10-minute interval between each timestamp.Latitude and Longitude: The latitude and longitude coordinates indicate the location of the measurement in Bihar. The dataset covers 20 specified localities in Bihar including Kankarbagh Rajendra Nagar Boring Road Ashok Rajpath Danapur Anandpuri Bailey Road Gardanibagh Patliputra Colony Phulwari Sharif Exhibition Road Pataliputra Fraser Road Kidwaipuri Gandhi Maidan S.K. Puri Anisabad Boring Canal Road Bankipore and Kumhrar.Signal Strength (dBm): The signal strength represents the received signal power in decibels (dBm) for different network types (3G 4G 5G and LTE). Signal Quality (%): The signal quality represents the percentage of signal strength relative to the maximum possible signal strength. It is calculated based on the signal strength values and is applicable for 3G 4G 5G and LTE networks. Unfortunately Signal Quality percentage yielded some error so it's 0.0 in all.Data Throughput (Mbps): The data throughput represents the network's capacity to transmit data measured in megabits per second (Mbps). Different network types have varying data throughput values.Latency (ms): Latency refers to the time delay between the transmission and reception of data packets measured in milliseconds (ms). Different network types have different latency values generated using a random uniform distribution within appropriate ranges.Network Type: The network type indicates the technology used for data transmission such as 3G 4G 5G or LTE. BB60C Measurement (dBm): The BB60C measurement represents the signal strength measured using the BB60C spectrum analyzer device. The values are generated based on the signal strength values with added random uniform noise specific to 4G 5G and LTE networks.srsRAN Measurement (dBm): The srsRAN measurement represents the signal strength measured using the srsRAN software-defined radio device. BladeRFxA9 Measurement (dBm): The BladeRFxA9 measurement represents the signal strength measured using the BladeRFxA9 software-defined radio device. The dataset is generated with a total of 1926 time periods and covers 20 localities in Bihar. It can be used for various purposes including network optimization coverage analysis and performance evaluation.Hardware Setup:The dataset replicates the hardware setup using the following components:The BB60C spectrum analyzer is connected to the Steam Deck's USB C port via an external USB3 hub. The srsRan and BladeRFxA9 devices are connected to a separate laptop which is running the srsenb software to create the base station.Additionally the Spike LTE Analysis tools are utilized to decode the LTE information in real-time. The dataset demonstrates how the Spike software DragonOS and SDR devices can be integrated to perform LTE analysis and the results can be combined with a working GPS for mapping purposes within the Spike software.Atlast We'd like to extend credits to our volunteers in these localities who helped in logging the data after replicating the setup.Let us know what you build out of this dataset. It's a subset of data that's being analysed for bio weapon usage in the Bihar area which's controlled via wireless signals to report to international delegates for expedited action against these.,9.41,https://www.kaggle.com/datasets/suraj520/cellular-network-analysis-dataset
french-youtubers,"The idea for this dataset came from a simple question: ""Can we study how Youtubers interact with sponsors ?"".So I decided to collect information myself on the videos of the 60 Best French Youtubers (without including VEVO or musician channels).To identify sponsored videos I decided afterwards to focus on those with a link in their description which will help identify the main sponsors.page-title15Mars3.csv (This is the final dataset I was able to get)yt-links : This includes the link visible in the descriptionlong-links : Some of the links in the descriptions are ""Bit.ly"" links which you need to open to find out about them. This column corresponds to the real link given each time.page-name : Name of the sponsor (This is extracted mainly from the domain name of the links but also sometimes from various details I've used from the description!)test31MarsFINAL.xlsx (The formatted file for social network analysis with Gephi)",8.82,https://www.kaggle.com/datasets/weddou/french-youtubers
animal-crossing-new-horizons-nookplaza-dataset,This dataset comes from this spreadsheet a comprehensive Item Catalog for Animal Crossing New Horizons (ACNH). As described by WikipediaACNH is a life simulation game released by Nintendo for Nintendo Switch on March 20 2020. It is the fifth main series title in the Animal Crossing series and with 5 million digital copies sold has broken the record for Switch title with most digital units sold in a single month. In New Horizons the player assumes the role of a customizable character who moves to a deserted island. Taking place in real-time the player can explore the island in a nonlinear fashion gathering and crafting items catching insects and fish and developing the island into a community of anthropomorphic animals.There are 30 csvs each listing various items villagers clothing and other collectibles from the game. The data was collected by a dedicated group of AC fans who continue to collaborate and build this spreadsheet for public use. The database contains the original data and full list of contributors and raw data. At the time of writing the only difference between the spreadsheet and this version is that the Kaggle version omits all columns with images of the items but is otherwise identical.Thanks to every contributor listed on the spreadsheet! Please attribute this spreadsheet and group for any use of the data. They also have a Discord server linked in the spreadsheet in case you want to contact them.,8.24,https://www.kaggle.com/datasets/jessicali9530/animal-crossing-new-horizons-nookplaza-dataset
CORD-19-research-challenge,In response to the COVID-19 pandemic the White House and a coalition of leading research groups have prepared the COVID-19 Open Research Dataset (CORD-19). CORD-19 is a resource of over 1000000 scholarly articles including over 400000 with full text about COVID-19 SARS-CoV-2 and related coronaviruses. This freely available dataset is provided to the global research community to apply recent advances in natural language processing and other AI techniques to generate new insights in support of the ongoing fight against this infectious disease. There is a growing urgency for these approaches because of the rapid acceleration in new coronavirus literature making it difficult for the medical research community to keep up.We are issuing a call to action to the world's artificial intelligence experts to develop text and data mining tools that can help the medical community develop answers to high priority scientific questions.  The CORD-19 dataset represents the most extensive machine-readable coronavirus literature collection available for data mining to date. This allows the worldwide AI research community the opportunity to apply text and data mining approaches to find answers to questions within and connect insights across this content in support of the ongoing COVID-19 response efforts worldwide. There is a growing urgency for these approaches because of the rapid increase in coronavirus literature making it difficult for the medical community to keep up.A list of our initial key questions can be found under the Tasks section of this dataset. These key scientific questions are drawn from the NASEMâ€™s SCIED (National Academies of Sciences Engineering and Medicineâ€™s Standing Committee on Emerging Infectious Diseases and 21st Century Health Threats) research topics and the World Health Organizationâ€™s R&D Blueprint for COVID-19.  Many of these questions are suitable for text mining and we encourage researchers to develop text mining tools to provide insights on these questions. We are maintaining a summary of the community's contributions. For guidance on how to make your contributions useful we're maintaining a forum thread with the feedback we're getting from the medical and health policy communities. Kaggle is sponsoring a $1000 per task award to the winner whose submission is identified as best meeting the evaluation criteria. The winner may elect to receive this award as a charitable donation to COVID-19 relief/research efforts or as a monetary payment. More details on the prizes and timeline can be found on the discussion post.We have made this dataset available on Kaggle. Watch out for periodic updates. The dataset is also hosted on AI2's Semantic Scholar. And you can search the dataset using AI2's new COVID-19 explorer.The licenses for each dataset can be found in the all _ sources _ metadata csv file.This dataset was created by the Allen Institute for AI in partnership  with the Chan Zuckerberg Initiative Georgetown Universityâ€™s Center for Security and Emerging Technology Microsoft Research IBM and the National Library of Medicine - National Institutes of Health in coordination with The White House Office of Science and Technology Policy.,8.82,https://www.kaggle.com/datasets/allen-institute-for-ai/CORD-19-research-challenge
creditcardfraud,It is important that credit card companies are able to recognize fraudulent credit card transactions so that customers are not charged for items that they did not purchase.The dataset contains transactions made by credit cards in September 2013 by European cardholders. This dataset presents transactions that occurred in two days where we have 492 frauds out of 284807 transactions. The dataset is highly unbalanced the positive class (frauds) account for 0.172% of all transactions.It contains only numerical input variables which are the result of a PCA transformation. Unfortunately due to confidentiality issues we cannot provide the original features and more background information about the data. Features V1 V2 â€¦ V28 are the principal components obtained with PCA the only features which have not been transformed with PCA are 'Time' and 'Amount'. Feature 'Time' contains the seconds elapsed between each transaction and the first transaction in the dataset. The feature 'Amount' is the transaction Amount this feature can be used for example-dependant cost-sensitive learning. Feature 'Class' is the response variable and it takes value 1 in case of fraud and 0 otherwise. Given the class imbalance ratio we recommend measuring the accuracy using the Area Under the Precision-Recall Curve (AUPRC). Confusion matrix accuracy is not meaningful for unbalanced classification.A simulator for transaction data has been released as part of the practical handbook on Machine Learning for Credit Card Fraud Detection - https://fraud-detection-handbook.github.io/fraud-detection-handbook/Chapter_3_GettingStarted/SimulatedDataset.html. We invite all practitioners interested in fraud detection datasets to also check out this data simulator and the methodologies for credit card fraud detection presented in the book.The dataset has been collected and analysed during a research collaboration of Worldline and the Machine Learning Group (http://mlg.ulb.ac.be) of ULB (UniversitÃ© Libre de Bruxelles) on big data mining and fraud detection.More details on current and past projects on related topics are available on https://www.researchgate.net/project/Fraud-detection-5 and the page of the DefeatFraud projectPlease cite the following works: Andrea Dal Pozzolo Olivier Caelen Reid A. Johnson and Gianluca  Bontempi. Calibrating Probability with Undersampling for Unbalanced  Classification. In Symposium on Computational Intelligence and Data  Mining (CIDM) IEEE 2015Dal Pozzolo Andrea; Caelen Olivier; Le Borgne Yann-Ael; Waterschoot Serge; Bontempi Gianluca.  Learned lessons in credit  card fraud detection from a practitioner perspective Expert systems with applications41104915-49282014 PergamonDal Pozzolo Andrea; Boracchi Giacomo; Caelen Olivier; Alippi  Cesare; Bontempi Gianluca. Credit card fraud detection: a realistic modeling and a novel learning strategy  IEEE transactions on neural networks and learning systems2983784-37972018IEEEDal Pozzolo Andrea Adaptive Machine learning for credit card fraud detection ULB MLG PhD thesis (supervised by G. Bontempi)Carcillo Fabrizio; Dal Pozzolo Andrea; Le Borgne Yann-AÃ«l; Caelen Olivier; Mazzer Yannis; Bontempi Gianluca. Scarff: a scalable  framework for streaming credit card fraud detection with Spark Information fusion41 182-1942018ElsevierCarcillo Fabrizio; Le Borgne Yann-AÃ«l; Caelen Olivier; Bontempi Gianluca. Streaming active learning strategies for real-life credit card fraud detection: assessment and visualization International Journal of Data Science and Analytics 54285-3002018Springer International PublishingBertrand Lebichot Yann-AÃ«l Le Borgne Liyun He Frederic OblÃ© Gianluca Bontempi Deep-Learning Domain Adaptation Techniques for Credit Cards Fraud Detection  INNSBDDL 2019: Recent Advances in Big Data and Deep Learning pp 78-88 2019Fabrizio Carcillo Yann-AÃ«l Le Borgne Olivier Caelen Frederic OblÃ© Gianluca Bontempi Combining Unsupervised and Supervised Learning in Credit Card Fraud Detection  Information Sciences 2019Yann-AÃ«l Le Borgne Gianluca Bontempi Reproducible machine Learning for Credit Card Fraud Detection - Practical Handbook  Bertrand Lebichot Gianmarco Paldino Wissam Siblini Liyun He Frederic OblÃ© Gianluca Bontempi Incremental learning strategies for credit cards fraud detection  IInternational Journal of Data Science and Analytics,8.53,https://www.kaggle.com/datasets/mlg-ulb/creditcardfraud
netflix-shows,   About this Dataset: Netflix is one of the most popular media and video streaming platforms. They have over 8000 movies or tv shows available on their platform as of mid-2021 they have over 200M Subscribers globally. This tabular dataset consists of listings of all the movies and tv shows available on Netflix along with details such as - cast directors ratings release year duration etc. Featured Notebooks: Click Here to View Featured NotebooksMilestone: Oct 18th 2021: Most Upvoted Dataset on Kaggle by an Individual ContributorCheck my Other Datasets,10.00,https://www.kaggle.com/datasets/shivamb/netflix-shows
novel-corona-virus-2019-dataset,From World Health Organization - On 31 December 2019 WHO was alerted to several cases of pneumonia in Wuhan City Hubei Province of China. The virus did not match any other known virus. This raised concern because when a virus is new we do not know how it affects people.So daily level information on the affected people can give some interesting insights when it is made available to the broader data science community. Johns Hopkins University has made an excellent dashboard using the affected cases data. Data is extracted from the google sheets associated and made available here.Edited: Now data is available as csv files in the Johns Hopkins Github repository. Please refer to the github repository for the Terms of Use details. Uploading it here for using it in Kaggle kernels and getting insights from the broader DS community. 2019 Novel Coronavirus (2019-nCoV) is a virus (more specifically a coronavirus) identified as the cause of an outbreak of respiratory illness first detected in Wuhan China. Early on many of the patients in the outbreak in Wuhan China reportedly had some link to a large seafood and animal market suggesting animal-to-person spread. However a growing number of patients reportedly have not had exposure to animal markets indicating person-to-person spread is occurring. At this time itâ€™s unclear how easily or sustainably this virus is spreading between people - CDCThis dataset has daily level information on the number of affected cases deaths and recovery from 2019 novel coronavirus. Please note that this is a time series data and so the number of cases on any given day is the cumulative number. The data is available from 22 Jan 2020.Main file in this dataset is covid_19_data.csv and the detailed descriptions are below.covid_19_data.csv2019_ncov_data.csvThis is older file and is not being updated now. Please use the covid_19_data.csv fileAdded two new files with individual level informationCOVID_open_line_list_data.csvThis file is obtained from this linkCOVID19_line_list_data.csvThis files is obtained from this linkCountry level datasetsIf you are interested in knowing country level data please refer to the following Kaggle datasets:India - https://www.kaggle.com/sudalairajkumar/covid19-in-indiaSouth Korea - https://www.kaggle.com/kimjihoo/coronavirusdatasetItaly - https://www.kaggle.com/sudalairajkumar/covid19-in-italyBrazil - https://www.kaggle.com/unanimad/corona-virus-brazilUSA - https://www.kaggle.com/sudalairajkumar/covid19-in-usaSwitzerland - https://www.kaggle.com/daenuprobst/covid19-cases-switzerlandIndonesia - https://www.kaggle.com/ardisragen/indonesia-coronavirus-casesPicture courtesy : Johns Hopkins University dashboardSome insights could be,9.71,https://www.kaggle.com/datasets/sudalairajkumar/novel-corona-virus-2019-dataset
chest-xray-pneumonia,http://www.cell.com/cell/fulltext/S0092-8674(18)30154-5Figure S6. Illustrative Examples of Chest X-Rays in Patients with Pneumonia Related to Figure 6The normal chest X-ray (left panel) depicts clear lungs without any areas of abnormal opacification in the image. Bacterial pneumonia (middle) typically exhibits a focal lobar consolidation in this case in the right upper lobe (white arrows) whereas viral pneumonia (right) manifests with a more diffuse â€˜â€˜interstitialâ€™â€™ pattern in both lungs.http://www.cell.com/cell/fulltext/S0092-8674(18)30154-5The dataset is organized into 3 folders (train test val) and contains subfolders for each image category (Pneumonia/Normal).  There are 5863 X-Ray images (JPEG) and 2 categories (Pneumonia/Normal). Chest X-ray images (anterior-posterior) were selected from retrospective cohorts of pediatric patients of one to five years old from Guangzhou Women and Childrenâ€™s Medical Center Guangzhou. All chest X-ray imaging was performed as part of patientsâ€™ routine clinical care. For the analysis of chest x-ray images all chest radiographs were initially screened for quality control by removing all low quality or unreadable scans. The diagnoses for the images were then graded by two expert physicians before being cleared for training the AI system. In order to account for any grading errors the evaluation set was also checked by a third expert.Data: https://data.mendeley.com/datasets/rscbjbr9sj/2License: CC BY 4.0Citation: http://www.cell.com/cell/fulltext/S0092-8674(18)30154-5Automated methods to detect and classify human diseases from medical images.,7.50,https://www.kaggle.com/datasets/paultimothymooney/chest-xray-pneumonia
videogamesales,This dataset contains a list of video games with sales greater than 100000 copies.  It was generated by a scrape of vgchartz.com.Fields includeRank - Ranking of overall salesName - The games namePlatform - Platform of the games release (i.e. PCPS4 etc.)Year - Year of the game's releaseGenre - Genre of the gamePublisher - Publisher of the gameNA_Sales - Sales in North America (in millions)EU_Sales - Sales in Europe (in millions)JP_Sales - Sales in Japan (in millions)Other_Sales - Sales in the rest of the world (in millions)Global_Sales - Total worldwide sales.The script to scrape the data is available at https://github.com/GregorUT/vgchartzScrape.It is based on BeautifulSoup using Python.There are 16598 records.  2 records were dropped due to incomplete information.,5.88,https://www.kaggle.com/datasets/gregorut/videogamesales
youtube-new,UPDATE: Source code used for collecting this data released hereYouTube (the world-famous video sharing website) maintains a list of the top trending videos on the platform. According to Variety magazine â€œTo determine the yearâ€™s top-trending videos YouTube uses a combination of factors including measuring users interactions (number of views shares comments and likes). Note that theyâ€™re not the most-viewed videos overall for the calendar yearâ€. Top performers on the YouTube trending list are music videos (such as the famously virile â€œGangam Styleâ€) celebrity and/or reality TV performances and the random dude-with-a-camera viral videos that YouTube is well-known for.This dataset is a daily record of the top trending YouTube videos.Note that this dataset is a structurally improved version of this dataset.This dataset includes several months (and counting) of data on daily trending YouTube videos. Data is included for the US GB DE CA and FR regions (USA Great Britain Germany Canada and France respectively) with up to 200 listed trending videos per day.EDIT: Now includes data from RU MX KR JP and IN regions (Russia Mexico South Korea Japan and India respectively) over the same time period.  Each regionâ€™s data is in a separate file. Data includes the video title channel title publish time tags views likes and dislikes description and comment count.The data also includes a category_id field which varies between regions. To retrieve the categories for a specific video find it in the associated JSON. One such file is included for each of the five regions in the dataset.For more information on specific columns in the dataset refer to the column metadata.This dataset was collected using the YouTube API.Possible uses for this dataset could include:For further inspiration see the kernels on this dataset!,7.94,https://www.kaggle.com/datasets/datasnaek/youtube-new
data-science-cheat-sheets,A collection of cheat sheets for various data-science related languages and topics.Taken from https://github.com/abhat222/Data-Science--Cheat-Sheet,8.75,https://www.kaggle.com/datasets/timoboz/data-science-cheat-sheets
google-play-store-apps,While many public datasets (on Kaggle and the like) provide Apple App Store data there are not many counterpart datasets available for Google Play Store apps anywhere on the web. On digging deeper I found out that iTunes App Store page deploys a nicely indexed appendix-like structure to allow for simple and easy web scraping. On the other hand Google Play Store uses sophisticated modern-day techniques (like dynamic page load) using JQuery making scraping more challenging.Each app (row) has values for catergory rating size and more.This information is scraped from the Google Play Store. This app information would not be available without it.The Play Store apps data has enormous potential to drive app-making businesses to success. Actionable insights can be drawn for developers to work on and capture the Android market!,7.06,https://www.kaggle.com/datasets/lava18/google-play-store-apps
